{
  "paper_title": "人工智能搜索引擎广告模式策略研究",
  "target_artifact": "undergraduate thesis",
  "completion_standard": "thesis-ready",
  "manuscript_type": "conceptual-paper",
  "study_completion_status": "literature-grounded",
  "language": "zh-CN",
  "citation_style": "GB/T 7714",
  "evidence_status": "mixed-full-text-and-abstract",
  "draft_status": "working-draft",
  "required_sections": [
    "中文摘要",
    "关键词",
    "引言",
    "文献综述",
    "人工智能搜索引擎广告模式分析",
    "策略优化路径",
    "结论与不足",
    "参考文献"
  ],
  "unresolved_gaps": [
    "摘要和结论仍需要做末轮压缩",
    "参考文献条目需要统一格式"
  ]
}
